{
  "colours": {
    "accent": "#b57614",
    "background": "#fbf1c7",
    "border": "#a89984",
    "danger": "#9d0006",
    "foreground": "#3c3836",
    "info": "#076678",
    "mauve": "#8f3f71",
    "muted": "#665c54",
    "selection_background": "#3c3836",
    "selection_foreground": "#fbf1c7",
    "success": "#79740e",
    "surface": "#ebdbb2",
    "surface_alt": "#d5c4a1",
    "teal": "#427b58",
    "warning": "#b57614"
  },
  "cursor": {
    "base": "Bibata-Modern-Classic",
    "base_colour": "#b57614",
    "colour_source": "theme",
    "handedness": "right",
    "mode": "generated",
    "outline_colour": "#fbf1c7",
    "shape_source": "theme",
    "sizes": [
      22,
      24
    ],
    "watch_background": "#3c3836"
  },
  "fonts": {
    "editor_size": 13,
    "gtk_size": 11,
    "mono": "Recursive Mono Linear Static",
    "panel": "MonaspiceRn Nerd Font Propo",
    "terminal_size": 12,
    "ui": "Alegreya"
  },
  "gtk": {
    "base_theme": "Graphite-Light-compact",
    "colour_source": "theme",
    "mode": "generated"
  },
  "hyprland": {
    "inactive_opacity": 1.0,
    "border_size": 1
  },
  "icons": {
    "theme": "Adwaita"
  },
  "id": "gruvbox-light",
  "name": "Gruvbox Light",
  "overrides": {
    "ansi": {
      "color0": "#fbf1c7",
      "color1": "#9d0006",
      "color10": "#98971a",
      "color11": "#d79921",
      "color12": "#458588",
      "color13": "#b16286",
      "color14": "#689d6a",
      "color15": "#282828",
      "color2": "#79740e",
      "color3": "#b57614",
      "color4": "#076678",
      "color5": "#8f3f71",
      "color6": "#427b58",
      "color7": "#3c3836",
      "color8": "#928374",
      "color9": "#cc241d"
    },
    "gtk": {},
    "hyprlock": {}
  },
  "schema_version": 1,
  "shape": {
    "density_scale": 1.0,
    "radius_scale": 1.25,
    "window_gap": null
  },
  "shell": {
    "bar": {
      "border": false,
      "density_automatic": true,
      "density_scale": 1.0,
      "edge_inset": 0,
      "items": [
        {
          "enabled": true,
          "id": "notes",
          "order": 0,
          "region": "start"
        },
        {
          "enabled": true,
          "id": "workspaces",
          "order": 0,
          "region": "centre"
        },
        {
          "enabled": true,
          "id": "clock",
          "order": 1,
          "region": "centre"
        },
        {
          "enabled": true,
          "id": "tray",
          "order": 0,
          "region": "end"
        },
        {
          "enabled": true,
          "id": "notifications",
          "order": 1,
          "region": "end"
        },
        {
          "enabled": true,
          "id": "power",
          "order": 2,
          "region": "end"
        },
        {
          "enabled": true,
          "id": "application-tray",
          "order": 0,
          "region": "hidden"
        },
        {
          "display": "toggle",
          "enabled": true,
          "id": "battery",
          "order": 1,
          "region": "hidden"
        },
        {
          "enabled": true,
          "id": "sound",
          "order": 2,
          "region": "hidden"
        },
        {
          "enabled": true,
          "id": "wifi",
          "order": 3,
          "region": "hidden"
        },
        {
          "enabled": true,
          "id": "active-window-title",
          "order": 4,
          "orientation": "inward",
          "region": "hidden"
        },
        {
          "enabled": true,
          "id": "privacy",
          "order": 5,
          "region": "hidden"
        },
        {
          "enabled": true,
          "id": "awake",
          "order": 6,
          "region": "hidden"
        },
        {
          "enabled": true,
          "id": "display",
          "order": 7,
          "region": "hidden"
        },
        {
          "enabled": true,
          "id": "bt",
          "order": 8,
          "region": "hidden"
        },
        {
          "enabled": true,
          "id": "updates",
          "order": 9,
          "region": "hidden"
        },
        {
          "enabled": true,
          "id": "fan",
          "order": 10,
          "region": "hidden",
          "visibility": "normal"
        },
        {
          "enabled": true,
          "id": "gpu",
          "order": 11,
          "region": "hidden",
          "visibility": "hybrid"
        },
        {
          "enabled": true,
          "id": "touchpad",
          "order": 12,
          "region": "hidden",
          "visibility": "normal"
        }
      ],
      "position": "bottom",
      "radius_automatic": true,
      "radius_scale": 1.25,
      "separate_groups": false
    },
    "notifications": {
      "offset_x": 0,
      "offset_y": 0,
      "position": "bottom-right"
    },
    "osd": {
      "offset_x": 0,
      "offset_y": 0,
      "position": "centre-bottom"
    }
  },
  "targets": {
    "btop": true,
    "code": true,
    "cursor": true,
    "cursor_editor": true,
    "glow": true,
    "grub": true,
    "gtk": true,
    "helium": true,
    "chromium": true,
    "hyprland": true,
    "hyprlock": true,
    "kitty": true,
    "micro": true,
    "obsidian": true,
    "powerlevel10k": true,
    "quickshell": true,
    "sddm": true,
    "stylus": true,
    "t3code": true,
    "wallpaper": true,
    "widgets": true,
    "zed": true
  },
  "stylus": {
    "style_set": "recommended"
  },
  "terminal": {
    "ansi_source": "override",
    "canvas": "#fbf1c7",
    "chrome_background": "#ebdbb2"
  },
  "variant": "light",
  "wallpaper": {
    "fit": "cover",
    "path": "wallpapers/showcase/gruvbox-light.webp"
  },
  "widgets": {
    "items": [],
    "profile": "minimal"
  }
}
